{
  "$schema": "schemas/scene_manifest.schema.json",
  "schema_version": "1.0.0",
  "package": {
    "name": "fr3_d435_real_workcell_scene_spec",
    "generated_at": "2026-07-17T22:16:00+08:00",
    "generation_mode": "repository_audit_plus_camera_only_table_survey",
    "live_camera_accessed": true,
    "live_robot_accessed": false,
    "canonical_length_unit": "m",
    "canonical_angle_unit": "rad",
    "canonical_time_unit": "s"
  },
  "evidence_classes": [
    "measured",
    "derived",
    "configured",
    "reported",
    "assumed",
    "unknown"
  ],
  "sources": {
    "deployment_calibration": {
      "kind": "packaged_snapshot",
      "portable_path": "source/calibration/fr3_d435_eye_to_hand.yaml",
      "original_path": "/home/qiaoguanren/code/franka/perception/configs/calibrations/fr3_d435_eye_to_hand.yaml",
      "sha256": "aa78c17ebb98d39eeda5b838a458818870d8d4e697f5762d1f5693b94188a1e4",
      "timestamp": "2026-07-16T17:32:12.940498+00:00"
    },
    "calibration_validation": {
      "kind": "packaged_snapshot",
      "portable_path": "source/calibration/fr3_d435_eye_to_hand.validation.yaml",
      "original_path": "/home/qiaoguanren/code/franka/perception/configs/calibrations/fr3_d435_eye_to_hand.validation.yaml",
      "sha256": "95734187f402f94441508c0744c77d4c5cbafc1f08a809a62d3d0a65d4d68ade",
      "timestamp": "2026-07-17 Asia/Shanghai"
    },
    "calibration_dataset": {
      "kind": "packaged_snapshot",
      "portable_path": "source/calibration/fr3_d435_aruco582_final_v2_dataset.yaml",
      "original_path": "/home/qiaoguanren/code/franka/beta/dynamic_object_pcd/calibration_runs/fr3_d435_aruco582_final_v2_dataset.yaml",
      "sha256": "2c4ff4b66f624740f5c5f227250d7f6d396409100d1beb66bc0789c53e8abe9e",
      "timestamp": "2026-07-16T17:19:05.060062+00:00"
    },
    "calibration_auto_audit": {
      "kind": "packaged_snapshot",
      "portable_path": "source/calibration/fr3_d435_eye_to_hand_v2_auto_audit.yaml",
      "original_path": "/home/qiaoguanren/code/franka/beta/dynamic_object_pcd/calibration_runs/fr3_d435_eye_to_hand_v2_auto_audit.yaml",
      "sha256": "07dd8f10e193b457d8cda31228900ab820f9b1d7790dd41e7b95e4c065ab30c6",
      "timestamp": "2026-07-16T17:26:06.863413+00:00"
    },
    "calibration_scene_image": {
      "kind": "packaged_snapshot",
      "portable_path": "evidence/final_v2_validation_001.png",
      "original_path": "/home/qiaoguanren/code/franka/beta/dynamic_object_pcd/calibration_runs/final_v2_validation_001.png",
      "sha256": "b156e89131b5976fc36dd1887647d2f2f3ee7bbd6257e8a3040f68dbd40c9858",
      "timestamp": "2026-07-17T01:24:40.755206381+08:00",
      "note": "Qualitative 848x480 color-frame evidence with ArUco overlay; not a metric scene survey."
    },
    "current_scene_color_image": {
      "kind": "packaged_snapshot",
      "portable_path": "evidence/current_d435_prompt.jpg",
      "original_path": "/tmp/current_d435_prompt.jpg",
      "sha256": "7f5f2a72e379b9310e3d46798de18988ffec2fa5ee70c34a550037c9b4b1e1be",
      "timestamp": "2026-07-17T20:55:31.460222223+08:00",
      "note": "Current 848x480 D435 color view. Timestamp is the source file mtime; no embedded camera timestamp, aligned depth, or synchronized robot joint state was available. Qualitative evidence only."
    },
    "runtime_config": {
      "kind": "packaged_snapshot",
      "portable_path": "source/runtime/d435_default.yaml",
      "original_path": "/home/qiaoguanren/code/franka/perception/configs/d435_default.yaml",
      "sha256": "c223fa599b8ff3ee33d4a9e7c2e2bada6ebfb8fa36d60a131e86a0891810729f",
      "timestamp": "2026-07-17T21:31:17.098861592+08:00",
      "note": "Snapshot of configured perception and commissioned hover limits; these are not measurements of scene geometry."
    },
    "hover_controller_source": {
      "kind": "external_source_reference",
      "original_path": "/home/qiaoguanren/code/franka/perception/dynamic_pcd/apps/hover_over_object.py",
      "sha256": "bc1fda1102398f8faae44e2ff9d7315581b89b6bf058d5449f39da838b055e4d",
      "timestamp": "2026-07-17T17:43:31.204467280+08:00"
    },
    "franka_description_installation": {
      "kind": "installed_asset_candidate",
      "package_name": "ros-humble-franka-description",
      "package_version": "1.0.1-3jammy.20260422.111300",
      "upstream_model_version": "1.0.1",
      "package_root": "/opt/ros/humble/share/franka_description",
      "timestamp": "2025-07-09T23:15:32+08:00",
      "note": "Local simulator asset candidate only. The physical arm revision has not been matched to fr3 versus fr3v2."
    },
    "user_reported_capture_volume": {
      "kind": "user_report",
      "timestamp": "2026-07-17 Asia/Shanghai",
      "note": "User described a 40 cm width, 30 cm height, 40 cm depth volume centered at the then-current EEF. That EEF pose and the volume axis convention were not recorded."
    },
    "user_prompt_target": {
      "kind": "user_report",
      "timestamp": "2026-07-17 Asia/Shanghai",
      "note": "Semantic target prompt example: pink cylinder."
    },
    "table_plane_roi_lower_center": {
      "kind": "live_camera_measurement",
      "portable_path": "measurements/table_plane_roi_lower_center.yaml",
      "sha256": "6ba152f1be92006b4a10a91a5141db5e84e9191e2d3d20dd1f6c31719447e274",
      "timestamp": "2026-07-17T22:11:05+08:00",
      "note": "Read-only D435 measurement; robot API was not imported or contacted."
    },
    "table_plane_roi_lower_right": {
      "kind": "live_camera_measurement",
      "portable_path": "measurements/table_plane_roi_lower_right.yaml",
      "sha256": "2cad61809e2f4f4698cfc8db92276fdffa88760711466baa671ae3d1a3451dbd",
      "timestamp": "2026-07-17T22:11:26+08:00",
      "note": "Read-only D435 measurement; robot API was not imported or contacted."
    },
    "table_plane_roi_upper_left": {
      "kind": "live_camera_measurement",
      "portable_path": "measurements/table_plane_roi_upper_left.yaml",
      "sha256": "edde0ce6dea48acf01332975be678891917ff64b376dea7e3c1fea52cfeb2abf",
      "timestamp": "2026-07-17T22:12:05+08:00",
      "note": "Read-only D435 measurement; robot API was not imported or contacted."
    },
    "table_plane_summary": {
      "kind": "derived_measurement_summary",
      "portable_path": "measurements/table_plane_summary.yaml",
      "sha256": "c0afa2e752214ae483578512bbce3b5b513fa98929abe7adbfed63e2a4a03287",
      "timestamp": "2026-07-17T22:16:00+08:00",
      "note": "Consensus plane through three separated local fitted-plane reference points; provisional for visual and non-contact alignment."
    }
  },
  "coordinate_conventions": {
    "transform_notation": "T_A_B maps coordinates expressed in frame B into frame A",
    "matrix_layout": "4x4 row-major nested arrays; points are column vectors conceptually",
    "robot_base": {
      "evidence_class": "reported",
      "frame_name": "robot_base",
      "source_refs": [
        "deployment_calibration"
      ],
      "note": "Corresponds to the base/O frame used by Franka O_T_EE in this project."
    },
    "camera_color_optical_frame": {
      "evidence_class": "reported",
      "frame_name": "camera_color_optical_frame",
      "axes": {
        "+x": "image right",
        "+y": "image down",
        "+z": "forward along optical axis"
      },
      "source_refs": [
        "deployment_calibration"
      ]
    },
    "simulation_world": {
      "evidence_class": "assumed",
      "value": "robot_base",
      "T_world_robot_base": [
        [1.0, 0.0, 0.0, 0.0],
        [0.0, 1.0, 0.0, 0.0],
        [0.0, 0.0, 1.0, 0.0],
        [0.0, 0.0, 0.0, 1.0]
      ],
      "units": {
        "translation": "m",
        "angle": "rad"
      },
      "note": "A simulation convention, not a measurement of the robot relative to the room or floor."
    }
  },
  "camera": {
    "identity": {
      "manufacturer": {
        "value": "Intel",
        "evidence_class": "reported"
      },
      "model": {
        "value": "RealSense D435",
        "evidence_class": "measured"
      },
      "serial": {
        "value": "337322072188",
        "evidence_class": "measured"
      },
      "source_refs": [
        "deployment_calibration",
        "calibration_dataset"
      ]
    },
    "stream": {
      "evidence_class": "measured",
      "color_format": "BGR8 in application memory",
      "depth_format": "Z16",
      "alignment": "depth aligned to color",
      "projection_frame": "camera_color_optical_frame",
      "width_px": 848,
      "height_px": 480,
      "fps": 30,
      "source_refs": [
        "deployment_calibration",
        "calibration_validation",
        "runtime_config"
      ]
    },
    "pinhole_intrinsics": {
      "evidence_class": "measured",
      "units": "pixel",
      "K": [
        [603.7852172851562, 0.0, 435.23577880859375],
        [0.0, 603.3232421875, 246.64630126953125],
        [0.0, 0.0, 1.0]
      ],
      "fx": 603.7852172851562,
      "fy": 603.3232421875,
      "cx": 435.23577880859375,
      "cy": 246.64630126953125,
      "distortion_model": "distortion.inverse_brown_conrady",
      "distortion_coefficients": [0.0, 0.0, 0.0, 0.0, 0.0],
      "source_refs": [
        "deployment_calibration",
        "calibration_dataset"
      ],
      "note": "Use an off-axis projection matrix. The principal point is not the geometric image center."
    },
    "derived_frustum": {
      "evidence_class": "derived",
      "horizontal_fov_deg_symmetric_approx": 70.15586017852266,
      "vertical_fov_deg_symmetric_approx": 43.3849997888613,
      "tangent_left": 0.720845370752163,
      "tangent_right": 0.6819713524005306,
      "tangent_top_image_down": 0.4088128618669705,
      "tangent_bottom_image_down": 0.38512306916606104,
      "derivation": "FOV=2*atan(image_size/(2*focal_length)); asymmetric tangents use cx, cy and pixel bounds [0,width-1] x [0,height-1].",
      "source_refs": [
        "deployment_calibration"
      ]
    },
    "depth": {